<?xml version="1.0" encoding="UTF-8"?>

<!-- generated on 2026-09-25T13:50:12.453404+01:00 by Eclipse SUMO sumo v1_27_1+0686-1020a595192
<sumoConfiguration xmlns:xsi="http://www.w3.org/2001/XMLSchema-instance" xsi:noNamespaceSchemaLocation="http://sumo.dlr.de/xsd/sumoConfiguration.xsd">

    <input>
        <net-file value="bugs/ticket3505_with_load_offset/input_net.net.xml"/>
        <route-files value="bugs/ticket3505_with_load_offset/input_routes.rou.xml"/>
    </input>

    <output>
        <vehroute-output value="bugs/ticket3505_with_load_offset/vehroutes.xml"/>
        <save-state.times value="50"/>
        <save-state.files value="bugs/ticket3505_with_load_offset/input_state.xml"/>
    </output>

    <processing>
        <time-to-teleport value="-1"/>
    </processing>

    <report>
        <duration-log.disable value="true"/>
        <no-step-log value="true"/>
    </report>

</sumoConfiguration>
-->

<snapshot type="micro" version="v1_27_1+0686-1020a595192" time="50.00" xmlns:xsi="http://www.w3.org/2001/XMLSchema-instance" xsi:noNamespaceSchemaLocation="http://sumo.dlr.de/xsd/state_file.xsd">
    <route id="r1" state="1" edges="4/1to3/1 3/1to2/1 2/1to1/1 1/1to0/1"/>
    <delay number="3" begin="3" end="0" depart="0.00" time="0.00" speedFactor="1.06" decel="3.50"/>
    <vType id="DEFAULT_VEHTYPE" length="3.00" minGap="2.00" maxSpeed="10.00" accel="0.8" decel="4.5" sigma="0"/>
    <vType id="t1" accel="2.5" decel="3.5"/>
    <vType id="t2" length="5.00" minGap="1.50" maxSpeed="20.00" color="yellow" accel="2.5" decel="4.5" sigma="0.5"/>
    <vehicle id="veh0" depart="0.00" departPos="100.00" departSpeed="10.00" route="r1" distance="400 0" speedFactor="1.0600" state="2072 0 1 100.00 0 16.86 49000 0 0 0 9223372036854774807 9223372036854774807 9223372036854774807" pos="21.40 18.40 5.60" speed="5.60 4.80" angle="270.00" posLat="0.00" waitingTime="100000 1 7000 18000" lcStateBase="0.00" lcState2="0 0 0 0 0">
        <device id="vehroute_veh0" state="0 0.00 10.00 100.00 0"/>
    </vehicle>
    <vehicle id="veh1" type="t1" depart="10.00" departPos="100.00" departSpeed="10.00" route="r1" distance="400 0" speedFactor="1.0600" state="2074 10000 1 100.00 0 9.92 49000 0 0 0 9223372036854774807 9223372036854774807 9223372036854774807" pos="8.28 3.28 4.17" speed="4.17 3.69" angle="270.00" posLat="0.00" waitingTime="100000 1 6000 7000" lcStateBase="0.00" lcState2="0 0 0 0 0">
        <device id="vehroute_veh1" state="0 0.00 10.00 100.00 0"/>
    </vehicle>
    <vehicle id="veh2" type="t2" depart="20.00" departPos="100.00" departSpeed="10.00" route="r1" distance="0 0" speedFactor="1.0104" state="2074 20000 0 100.00 0 1.52 49000 0 0 0 9223372036854774807 9223372036854774807 9223372036854774807" pos="377.70 372.70 9.32" speed="9.32 9.71" angle="270.00" posLat="0.00" waitingTime="100000 0" lcStateBase="0.00" lcState2="0 0 0 0 0">
        <device id="vehroute_veh2" state="0 0.00 10.00 100.00 0"/>
    </vehicle>
    <lane id="3/1to2/1_0">
        <vehicles value="veh1 veh0"/>
    </lane>
    <lane id="4/1to3/1_0">
        <vehicles value="veh2"/>
    </lane>
    <tlLogic id="0/0" programID="0" phase="2" duration="16000" until="65000" cycleTime="50000" active="1"/>
    <tlLogic id="0/1" programID="0" phase="4" duration="7000" until="74000" cycleTime="50000" active="1"/>
    <tlLogic id="0/2" programID="0" phase="2" duration="16000" until="65000" cycleTime="50000" active="1"/>
    <tlLogic id="1/0" programID="0" phase="4" duration="7000" until="74000" cycleTime="50000" active="1"/>
    <tlLogic id="1/1" programID="0" phase="4" duration="7000" until="74000" cycleTime="50000" active="1"/>
    <tlLogic id="1/2" programID="0" phase="4" duration="7000" until="74000" cycleTime="50000" active="1"/>
    <tlLogic id="2/0" programID="0" phase="4" duration="7000" until="74000" cycleTime="50000" active="1"/>
    <tlLogic id="2/1" programID="0" phase="4" duration="7000" until="74000" cycleTime="50000" active="1"/>
    <tlLogic id="2/2" programID="0" phase="4" duration="7000" until="74000" cycleTime="50000" active="1"/>
    <tlLogic id="3/0" programID="0" phase="4" duration="7000" until="74000" cycleTime="50000" active="1"/>
    <tlLogic id="3/1" programID="0" phase="4" duration="7000" until="74000" cycleTime="50000" active="1"/>
    <tlLogic id="3/2" programID="0" phase="4" duration="7000" until="74000" cycleTime="50000" active="1"/>
    <tlLogic id="4/0" programID="0" phase="2" duration="16000" until="65000" cycleTime="50000" active="1"/>
    <tlLogic id="4/1" programID="0" phase="4" duration="7000" until="74000" cycleTime="50000" active="1"/>
    <tlLogic id="4/2" programID="0" phase="2" duration="16000" until="65000" cycleTime="50000" active="1"/>
</snapshot>
